{
  "id": "akash-raptoreum-miner",
  "title": "raptoreum-miner",
  "description": "raptoreum-miner deployed on Akash Network via Blazing Core.",
  "category": "Akash — Mining Cpu",
  "difficulty": "Intermediate",
  "time": "5 min",
  "tags": [
    "akash",
    "blazing-core",
    "mining",
    "cpu"
  ],
  "technologies": [],
  "products": [
    "blazing-core"
  ],
  "primaryProduct": "blazing-core"
}
