{
  "id": "cleanup_expired_records",
  "title": "Cleanup Expired Records",
  "description": "Batch delete expired database records on a schedule \u2014 demonstrates Blazing Flow's distributed step execution model with typed inputs and structured outputs.",
  "tags": [
    "batch",
    "blazing-flow",
    "distributed",
    "python"
  ],
  "technologies": [],
  "category": "Advanced",
  "difficulty": "Intermediate",
  "time": "20 min",
  "products": [
    "blazing-flow"
  ],
  "primaryProduct": "blazing-flow"
}
