{
  "id": "akash-iperf3",
  "title": "iperf3",
  "description": "iperf3 deployed on Akash Network via Blazing Core.",
  "category": "Akash — Benchmarking",
  "difficulty": "Intermediate",
  "time": "5 min",
  "tags": [
    "akash",
    "blazing-core",
    "benchmarking"
  ],
  "technologies": [],
  "products": [
    "blazing-core"
  ],
  "primaryProduct": "blazing-core"
}
