{
  "id": "akash-tetris2",
  "title": "Tetris2 on Akash",
  "description": "Deploy the classic Tetris2 game on Akash decentralized cloud. Uses reverse-auction pricing with a max bid of $15/month. Single region (akash-global) with public HTTP ingress on port 80.",
  "category": "Akash -- Games",
  "difficulty": "Beginner",
  "time": "5 min",
  "tags": [
    "akash",
    "blazing-core",
    "games",
    "decentralized",
    "reverse-auction",
    "single-region",
    "public-ingress"
  ],
  "technologies": [
    "Akash Network"
  ],
  "products": [
    "blazing-core"
  ],
  "primaryProduct": "blazing-core"
}
