{
  "id": "akash-jira",
  "title": "jira",
  "description": "jira deployed on Akash Network via Blazing Core.",
  "category": "Akash — Project Management",
  "difficulty": "Intermediate",
  "time": "5 min",
  "tags": [
    "akash",
    "blazing-core",
    "project",
    "management"
  ],
  "technologies": [],
  "products": [
    "blazing-core"
  ],
  "primaryProduct": "blazing-core"
}
