{
  "id": "akash-micro-services-example",
  "title": "micro-services-example",
  "description": "micro-services-example deployed on Akash Network via Blazing Core.",
  "category": "Akash — Cicd Devops",
  "difficulty": "Intermediate",
  "time": "5 min",
  "tags": [
    "akash",
    "blazing-core",
    "cicd",
    "devops"
  ],
  "technologies": [],
  "products": [
    "blazing-core"
  ],
  "primaryProduct": "blazing-core"
}
