{
  "id": "akash-ace-music-ai",
  "title": "Ace-Music-AI",
  "description": "Ace-Music-AI deployed on Akash Network via Blazing Core.",
  "category": "Akash — Ai Gpu",
  "difficulty": "Intermediate",
  "time": "5 min",
  "tags": [
    "akash",
    "blazing-core",
    "gpu"
  ],
  "technologies": [],
  "products": [
    "blazing-core"
  ],
  "primaryProduct": "blazing-core"
}
