{
  "id": "akash-nbminer-c11",
  "title": "nbminer-c11",
  "description": "nbminer-c11 deployed on Akash Network via Blazing Core.",
  "category": "Akash — Mining Gpu",
  "difficulty": "Intermediate",
  "time": "5 min",
  "tags": [
    "akash",
    "blazing-core",
    "mining",
    "gpu"
  ],
  "technologies": [],
  "products": [
    "blazing-core"
  ],
  "primaryProduct": "blazing-core"
}
