{
  "id": "data_transformation_workflow",
  "title": "Data Transformation Workflow",
  "description": "Multi-stage data pipeline with cleaning and normalization \u2014 demonstrates Blazing Flow's distributed step execution model with typed inputs and structured outputs.",
  "tags": [
    "distributed",
    "pipeline",
    "python",
    "workflow"
  ],
  "technologies": [],
  "category": "Getting Started",
  "difficulty": "Beginner",
  "time": "10 min",
  "products": [
    "blazing-flow"
  ],
  "primaryProduct": "blazing-flow"
}
