{
  "id": "satellite_image_vectors",
  "title": "Satellite Image Vectors",
  "description": "Geospatial ML pipeline — read GeoTIFF with rasterio, extract 256x256 tiles, generate Clay or sentence-transformer embeddings, and index with MongoDB 2dsphere for geospatial search.",
  "category": "Real World Applications",
  "difficulty": "Advanced",
  "time": "20 min",
  "tags": [
    "geospatial",
    "rasterio",
    "mongodb",
    "vectors"
  ],
  "products": [
    "blazing-flow"
  ],
  "primaryProduct": "blazing-flow"
}
