{
  "id": "akash-iron-fish",
  "title": "iron-fish",
  "description": "iron-fish deployed on Akash Network via Blazing Core.",
  "category": "Akash — Mining Cpu",
  "difficulty": "Intermediate",
  "time": "5 min",
  "tags": [
    "akash",
    "blazing-core",
    "mining",
    "cpu"
  ],
  "technologies": [],
  "products": [
    "blazing-core"
  ],
  "primaryProduct": "blazing-core"
}
